<?xml version="1.0" encoding="utf-8"?>
<chapter xmlns="http://www.mhdante.com" xmlns:xsi="http://www.w3.org/2001/XMLSchema-instance" xsi:schemaLocation="http://www.mhdante.com https://raw.githubusercontent.com/MHDante/ghostCatcherAndroid/master/schema.xsd">
  <chars>
    <character id="char1" name="Professor Wolfe">
      <bio>Professor Wolfe introduced himself when I inadvertently downloaded this Ghost Catcher app.  He's an overconfident yet distraught. He seems intent on catching ghosts, whatever the consequence....</bio>
      <pose id="pose0" image="pose0.png" />
      <pose id="pose1" image="pose1.png" />
      <pose id="pose2" image="pose2.png" />
      <pose id="pose3" image="pose3.png" />
      <pose id="pose4" image="pose4.png" />
      <pose id="pose5" image="pose5.png" />
      <pose id="pose6" image="pose6.png" />
      <pose id="pose7" image="pose7.png" />
      <pose id="pose8" image="pose8.png" />
      <pose id="pose9" image="pose9.png" />
      <pose id="pose10" image="pose10.png" />
      <pose id="pose11" image="pose11.png" />
      <pose id="pose12" image="pose12.png" />
      <pose id="pose13" image="pose13.png" />
      <pose id="pose14" image="pose14.png" />
      <pose id="pose15" image="pose15.png" />
      <pose id="pose16" image="pose16.png" />
      <pose id="pose17" image="pose17.png" />
      <pose id="pose18" image="pose18.png" />
      <pose id="pose19" image="pose19.png" />
      <pose id="pose20" image="pose20.png" />
      <pose id="pose21" image="pose21.png" />
    </character>
  </chars>
  <locs>
    <location id="loc1" name="RCC – Church and Gould" lat="43.65827" long="-79.37772" tagline="" />
    <location id="loc2" name="Lake Devo" lat="43.65769" long="-79.37981" tagline="" />
    <location id="loc3" name="Ram in the Rye" lat="43.65783" long="-79.37775" tagline="" />
  </locs>
  <timeline>
    <seq_pt id="01" name="Introduction">
      <triggers>
        <trigger id="00" type="AUTO" data="" enabled="true" timelimit="">
          <action type="DIALOG" lock="true">intro</action>
          <action type="ENABLE_TOOL" lock="false">locationmap</action>
		  <action type="ENABLE_TOOL" lock="false">rfdetector</action>
          <action type="ENABLE_TRIGGER" lock="false">01</action>
		  <action type="DISABLE_TRIGGER" lock="false">00</action>
        </trigger>
        <trigger id="01" type="LOCATION_ENTER" data="loc1" enabled="false" timelimit="">
          <action type="DIALOG" lock="true">1</action>
          <action type="ENABLE_TRIGGER" lock="true">01</action>
		  <action type="DISABLE_TRIGGER" lock="false">00</action>
        </trigger>
                <trigger id="01" type="LOCATION_ENTER" data="loc2" enabled="false" timelimit="">
          <action type="DIALOG" lock="true">2</action>
          <action type="ENABLE_TRIGGER" lock="true">01</action>
		  <action type="DISABLE_TRIGGER" lock="false">00</action>
        </trigger>
                <trigger id="01" type="LOCATION_ENTER" data="loc3" enabled="false" timelimit="">
          <action type="DIALOG" lock="true">3</action>
          <action type="ENABLE_TRIGGER" lock="true">01</action>
		  <action type="DISABLE_TRIGGER" lock="false">00</action>
        </trigger>
      </triggers>
    </seq_pt>
  </timeline>
</chapter>